{
  "schema": "agent-ide.macos-acceptance.v1",
  "revision": "d2f7b4ddc4284ae4a275bc3f4e183413cb9d1bff",
  "route": "codex",
  "status": "real_pass",
  "platform": {"os": "macos", "version": "27.0", "architecture": "arm64"},
  "host": {"version": "codex-cli-0.159.3"},
  "toolchains": {"go": "not_tested", "gopls": "not_tested", "rust": "1.98.1", "rust_analyzer": "1.98.1", "node": "24.4.0", "pyright": "1.1.413", "typescript_language_server": "6.0.0", "typescript": "5.9.3"},
  "scenarios": {"edit_diagnostic_loop": "real_pass", "stale_edit_zero_write": "real_pass", "native_fallback": "real_pass", "telemetry_restart_query_export": "real_pass", "compact_content": "real_pass", "python_provider": "real_pass", "typescript_r3": "real_pass", "divergent_worktrees": "real_pass"},
  "privacy": {"source": false, "prompts": false, "credentials": false, "commands": false, "paths": false, "diagnostic_messages": false, "private_ids": false}
}
