{
  "schema": "agent-ide.macos-acceptance.v1",
  "revision": "d88af079ac1e0c06d411208f513a1bfefeddf4b1",
  "route": "claude",
  "status": "not_tested",
  "platform": {"os": "macos", "version": "26.6.2", "architecture": "arm64"},
  "host": {"version": "not_tested"},
  "toolchains": {"go": "not_tested", "gopls": "not_tested", "rust": "not_tested", "rust_analyzer": "not_tested", "node": "not_tested", "pyright": "not_tested", "typescript_language_server": "not_tested", "typescript": "not_tested"},
  "scenarios": {"edit_diagnostic_loop": "not_tested", "stale_edit_zero_write": "not_tested", "native_fallback": "not_tested", "telemetry_restart_query_export": "not_tested", "compact_content": "not_tested", "python_provider": "not_tested", "typescript_r3": "not_tested", "divergent_worktrees": "not_tested"},
  "privacy": {"source": false, "prompts": false, "credentials": false, "commands": false, "paths": false, "diagnostic_messages": false, "private_ids": false}
}
